project_id,repo,commit,property_id,classification,code_path,proof_trace,attack_scenario,result,reason
N5,openldap/openldap,519e0c94c9f3804813f691de487283ad7586f510,PROP-N5-npd-010,potential-vulnerability,clients/tools/ldapvc.c::main::L312-313,"The return value of `getpassphrase()` is not checked for NULL before being passed to `strdup()` at line 312. POSIX `getpass`-family functions return NULL when stdin is unavailable or on I/O error; passing NULL to `strdup()` is undefined behavior (typically a crash), and if strdup returns NULL, `strlen(cred.bv_val)` at line 313 dereferences NULL. No null guard exists on this code path.","Run `ldapvc -H ldap://server 'uid=user,dc=example,dc=com'` with stdin redirected from `/dev/null` (e.g. in a cron job or automated pipeline without a terminal); `getpassphrase()` returns NULL, `strdup(NULL)` crashes the process with a null pointer dereference, causing denial of service of the client tool.",,
N5,openldap/openldap,519e0c94c9f3804813f691de487283ad7586f510,PROP-N5-npd-107,potential-vulnerability,libraries/libldap/util-int.c::ldap_pvt_ctime::L92-113,"At line 108, `AC_MEMCPY( buf, ctime(tp), 26 )` passes the return value of `ctime()` directly to memcpy without checking for NULL; POSIX defines `ctime()` to return NULL for out-of-range time_t values, and on 32-bit builds the Y2038 wraparound produces exactly such a value, causing `memcpy(buf, NULL, 26)` — undefined behaviour / crash. The `USE_CTIME_R` compile path does not share this defect, but the mutex-protected fallback path (the `#else` branch) has no guard.","On a 32-bit OpenLDAP deployment approaching or past year 2038, `lc->lconn_lastused` wraps to a negative time_t; the LDAP debug/connection-dump path at request.c:879 calls `ldap_pvt_ctime(&lc->lconn_lastused, ...)`, `ctime()` returns NULL, and the server crashes — a denial-of-service achievable by any connected client that triggers connection enumeration logging.",,
N5,openldap/openldap,519e0c94c9f3804813f691de487283ad7586f510,PROP-N5-npd-123,potential-vulnerability,libraries/liblunicode/ucdata/ucdata.c::uccanoncomp::L677,"`uccanoncomp` unconditionally dereferences `str[0]` at L677 without a NULL guard; `uccomp_hangul` does the same at L632. The caller in `ucstr.c:239` invokes `uccompatdecomp(...)` without checking its return value, so if allocation fails (OOM), `ucsout` is NULL and `ucsoutlen` is -1, and `uccanoncomp(NULL, -1)` is called, triggering NPD. The HARDCODE_DATA=1 default build keeps data arrays safe (static const from uctable.h), but this NULL-str path is reachable in production.","An attacker sends many large Unicode-containing LDAP requests to exhaust server heap, then a subsequent request containing non-ASCII attribute values reaches the `uccompatdecomp`→`uccanoncomp` normalization path; OOM causes `uccompatdecomp` to return -1 with `ucsout=NULL`, and `uccanoncomp` crashes the slapd process with a NULL dereference (DoS).",,
N5,openldap/openldap,519e0c94c9f3804813f691de487283ad7586f510,PROP-N5-npd-051,potential-vulnerability,libraries/libldap/getdn.c::str2strval::L1532-1543,"Four parsing functions — str2strval (L1542), DCE2strval (L1644), IA52strval (L1729), and quotedIA52strval (L1823) — call LDAP_STRNDUPX (ber_strndup_x) in their escapes==0 branch without checking the return value for NULL; on allocation failure they return 0 (success) with val->bv_val=NULL and non-zero val->bv_len. This NULL bv_val propagates into an LDAPAVA la_value field, and when the DN is later serialized via strval2strlen (L2060-2061), the code computes end=NULL+len-1 and then dereferences p[0] on a NULL pointer. The NONPRINTABLE branch in the same if-block has a correct NULL check, making the omission in the printable path an oversight rather than intentional design.","An attacker sends LDAP requests with DN attribute values composed of long printable ASCII characters (no escaping required, the common case), driving the server into memory pressure via heap exhaustion; when LDAP_STRNDUPX returns NULL the parser silently succeeds with a NULL bv_val, and any subsequent DN serialization call (e.g., via ldap_dn2str or ldap_rdn2str) dereferences the NULL pointer in strval2strlen, crashing the LDAP server process.",,
N5,openldap/openldap,519e0c94c9f3804813f691de487283ad7586f510,PROP-N5-npd-059,potential-vulnerability,libraries/libldap/messages.c::ldap_get_message_ber::L64-68,"`ldap_get_message_ber` dereferences its `LDAPMessage *ld` parameter as `ld->lm_ber` with no NULL guard — unlike every other function in the file which uses `assert(param != NULL)`. The caller at `servers/slapd/back-ldap/search.c:373-374` passes the result of `ldap_first_entry()` directly to `ldap_build_entry()` without a NULL check (the same file's other call site at L1007 does have the check), so a NULL return from `ldap_first_entry` flows into `ldap_get_message_ber` and causes a NULL dereference.","An attacker controlling a backend LDAP server (e.g., via a compromised upstream in a proxy/meta topology) returns a malformed SEARCH_ENTRY response where the inner message type mismatches, causing `ldap_first_entry` at `back-ldap/search.c:373` to return NULL; that NULL is passed unchecked to `ldap_build_entry` → `ldap_get_message_ber(NULL)` → crash/DoS of the slapd proxy process.",,
N5,openldap/openldap,519e0c94c9f3804813f691de487283ad7586f510,PROP-N5-npd-067,potential-vulnerability,libraries/libldap/pagectrl.c::ldap_create_page_control::L136-161,"`ldap_create_page_control` (L145-148) and `ldap_parse_page_control` (L242-250) each dereference `ld->ld_errno` without any NULL guard on `ld`, while their sibling functions `ldap_create_page_control_value` (L63) and `ldap_parse_pageresponse_control` (L188) in the same file explicitly check `ld == NULL`. This inconsistency means a NULL session handle passed by any caller triggers a null pointer dereference and process crash.","If `ldap_init()` returns NULL (e.g., under memory pressure or connection exhaustion) and the caller does not check before invoking `ldap_create_page_control` or `ldap_parse_page_control`, the immediate dereference of `ld->ld_errno` (L146/L243) crashes the process, enabling a remote DoS when a network attacker can trigger the NULL-init condition.",,
N5,openldap/openldap,519e0c94c9f3804813f691de487283ad7586f510,PROP-N5-npd-075,potential-vulnerability,libraries/libldap/result.c::try_read1msg::L1083-1085,"Phase 1 maps the NPD property to all pointer dereferences in result.c. Phase 2 proof fails at line 1085 (inside `#ifdef LDAP_CONNECTIONLESS`): `*result = chkResponseList(ld, msgid, all)` is immediately dereferenced as `(*result)->lm_msgtype` with no NULL check. `chkResponseList` explicitly documents returning NULL (debug trace at line 225; proper NULL check exists at the identical call on line 297 in `wait4msg`). In the CLDAP (UDP) multi-message path (`moremsgs==1`), if the outstanding msgid is concurrently abandoned by another thread, `chkResponseList` removes all matching messages and returns NULL, causing a null pointer dereference. Phase 3 stress-test confirms: the `wait4msg` call at line 297 shows the pattern is known and guarded elsewhere, making the omission at line 1085 a genuine oversight rather than intentional design.",An attacker controlling a CLDAP (UDP) server sends multiple partial search responses (triggering `moremsgs=1`) while a second thread on the client concurrently calls `ldap_abandon()` on the same msgid; `chkResponseList` at line 1083 returns NULL and the dereference at line 1085 crashes the client process.,,
N5,openldap/openldap,519e0c94c9f3804813f691de487283ad7586f510,PROP-N5-npd-083,potential-vulnerability,libraries/libldap/stctrl.c::ldap_create_session_tracking_control::L132-159,"`ldap_create_session_tracking_control` dereferences `ld` at lines 143, 144, 147, 150, 151, 153, and 158 without any prior check that `ld != NULL`. Its sister function `ldap_create_session_tracking_value` (lines 50-59) correctly guards against `ld == NULL` before any dereference; this function omits that guard entirely. The property therefore fails on the path: `ctrlp == NULL` or `ctrlp != NULL` with `ld == NULL`.","A caller that passes `ld = NULL` to `ldap_create_session_tracking_control` (e.g., if an error-recovery path in an LDAP client sets `ld` to NULL before calling this function, or a wrapper layer controllable via server-side error responses) triggers a NULL dereference crash at line 143 or 147, potentially enabling denial-of-service against the LDAP client process.",,
N5,openldap/openldap,519e0c94c9f3804813f691de487283ad7586f510,PROP-N5-npd-108,vulnerability,libraries/libldap/vc.c::ldap_parse_verify_credentials::L108-116,"`cookie` and `screds` are optional output parameters (not asserted non-NULL, no guards); `ldap_verify_credentials_s` (L317) passes the caller-supplied `scookie`/`scred` pointers directly, which may be NULL. When the server includes `LDAP_TAG_EXOP_VERIFY_CREDENTIALS_COOKIE` or `LDAP_TAG_EXOP_VERIFY_CREDENTIALS_SCREDS` in its VCResponse, `ber_scanf(ber, ""O"", cookie)` is invoked with a NULL destination pointer, writing an allocated `struct berval *` to address zero—a NULL dereference crash. The correct pattern (used in sasl.c:343-358) reads into a local variable first, then assigns to the output pointer only if it is non-NULL. A secondary NULL dereference exists at L101-103 where the result of `LDAP_MALLOC` is used via `AC_MEMCPY` and indexed without an OOM check.","An attacker controlling the LDAP server (MITM or rogue server) crafts a VCResponse that includes an optional cookie or serverSaslCreds field; a client that calls `ldap_verify_credentials_s(..., NULL /*scookie*/, NULL /*scred*/, ...)` will dereference NULL in `ber_scanf` at L109/L115, crashing the client process (remote denial of service).",,
N5,openldap/openldap,519e0c94c9f3804813f691de487283ad7586f510,PROP-N5-npd-140,potential-vulnerability,libraries/liblutil/meter.c::text_open::L206-220,"In `text_open`, `calloc` results are guarded only by `assert()` (L213, L216), which is a no-op in release builds (NDEBUG). If either `calloc` call fails, `data` or `data->buffer` is NULL, and the immediately following struct-member assignment (`data->buffer_length = ...`) or `text_update`'s `*buf++ = ...` is an unconditional NULL dereference. However, all callers of the meter API (slapadd.c, slapmodify.c, back-mdb/tools.c) are offline administrative tools — not the live slapd LDAP request handler — so the stated LDAP external reachability does not hold.","An administrator running `slapadd` or `slapmodify` under memory pressure (or an attacker causing OOM via repeated large LDAP requests to exhaust server memory before an admin operation) could trigger the calloc failure in `text_open`, crashing the admin tool via NULL dereference at `data->buffer_length = default_buffer_length` (L214).",,
N5,openldap/openldap,519e0c94c9f3804813f691de487283ad7586f510,PROP-N5-npd-164,vulnerability,libraries/librewrite/xmap.c::rewrite_xmap_apply::L364-430,"In the REWRITE_MAP_XLDAPMAP case, `lud->lud_filter` is passed directly as the format-string argument to snprintf (line 384) and `lud->lud_attrs[0]` is dereferenced (line 387) with no NULL guards. `ldap_url_parse` (url.c:892-894) initialises both fields to NULL and only sets them when the corresponding URL component is present; a valid LDAP URL such as `ldap://host/dc=example,dc=com??sub` therefore yields a successfully-parsed descriptor where both fields are NULL. `rewrite_xmap_parse` stores the descriptor without validating these fields, so the crash is deferred to apply-time.","An LDAP rewrite rule is configured with an xldap map whose URL omits the filter and/or attributes component (e.g., `${xldap(ldap://internal/dc=corp,dc=com??sub)}`). Any subsequent external LDAP request that triggers this rewrite rule causes `rewrite_xmap_apply` to reach line 384 (NULL format-string to snprintf) or line 387 (dereference of NULL `lud_attrs`), crashing the OpenLDAP daemon and producing a remotely-triggered denial of service.",,
N5,openldap/openldap,519e0c94c9f3804813f691de487283ad7586f510,PROP-N5-npd-020,potential-vulnerability,libraries/liblber/io.c::ber_flatten::L427-451,"`ber_flatten` dereferences `ber->ber_memctx` at line 440 without any null check on `ber`, while its companion `ber_flatten2` explicitly handles `ber == NULL` at line 396 (creating an empty berval), implying the API contract permits NULL — the proof that all dereferences are guarded fails here. Additionally, accessor functions `ber_start` (L693), `ber_len` (L699), `ber_ptrlen` (L705), `ber_rewind` (L711-714), and `ber_remaining` (L724) perform unguarded dereferences with no null checks whatsoever; most other functions rely solely on `assert()` which is stripped in production builds.","An attacker induces memory exhaustion via large or numerous LDAP requests; if `ber_alloc_t()` returns NULL and calling server code omits the return-value check before passing the result to `ber_flatten`, the server dereferences NULL at line 440, crashing the LDAP daemon (remote DoS).",,
N5,openldap/openldap,519e0c94c9f3804813f691de487283ad7586f510,PROP-N5-npd-044,potential-vulnerability,libraries/libldap/error.c::ldap_parse_result::L300-354,"`ldap_parse_result` calls `ber_dup(lm->lm_ber)` at L300 and then passes the result directly to `ber_scanf()` at L303/L309 with no NULL guard; if `ber_dup()` returns NULL on allocation failure, `ber_scanf(NULL, ...)` dereferences NULL. The developer's NULL check at L361 (before `ber_free`) confirms awareness that `ber_dup` can return NULL, but the guard was omitted before all four `ber_scanf` call sites. Sibling functions `sasl.c:302` and `extended.c:224` both correctly check `if (ber == NULL) return LDAP_NO_MEMORY` immediately after `ber_dup`, confirming this is an omission rather than intentional design.","An attacker controlling an LDAP server (or acting as a man-in-the-middle) can exhaust the client process's heap via repeated large responses and then deliver a valid LDAP result; when `ldap_parse_result` calls `ber_dup()` under low-memory conditions and receives NULL, the subsequent `ber_scanf(NULL, ...)` causes a null pointer dereference, crashing the LDAP client process.",,
N5,openldap/openldap,519e0c94c9f3804813f691de487283ad7586f510,PROP-N5-npd-092,potential-vulnerability,libraries/libldap/thr_posix.c::ldap_pvt_thread_key_getdata::L358-362,"The only pointer dereference occurring in thr_posix.c source code itself is `*data = pthread_getspecific(key)` at line 360 (all other pointer params are forwarded directly to libc pthread functions). No NULL check guards `data` before this dereference; the function is exported as a public API symbol (ldap.map:345), so callers can pass NULL. The sole internal call site (tpool.c:1457) passes `&ctx` (stack address, always non-NULL), so no current code path triggers the defect.","A caller invoking `ldap_pvt_thread_key_getdata(key, NULL)` — whether an external plugin or a misbehaving library consumer — would cause a NULL dereference crash (SIGSEGV); no LDAP-protocol-reachable path to pass NULL as the `data` argument has been identified in the current codebase.",,
N5,openldap/openldap,519e0c94c9f3804813f691de487283ad7586f510,PROP-N5-npd-100,potential-vulnerability,libraries/libldap/turn.c::ldap_turn::L50-54,"`ber_alloc_t(LBER_USE_DER)` (L50 / L80) can return NULL on heap exhaustion; neither `ldap_turn` nor `ldap_turn_s` checks the return value before passing `turnvalber` to `ber_printf()` (L52/54, L82/84). `ber_printf` contains only debug-build assertions (`assert(ber != NULL)`) and immediately dereferences the pointer in its loop body — in production builds (NDEBUG) this is a NULL pointer dereference / crash. `ber_flatten2` and `ber_free` both handle NULL safely, so the defect is confined to the unchecked `ber_printf` call.","A malicious LDAP server sends large BER-encoded responses to exhaust the client's heap; when the client subsequently calls `ldap_turn()` or `ldap_turn_s()`, `ber_alloc_t()` returns NULL and `ber_printf(NULL, ...)` dereferences it, crashing the client process (DoS). The same unchecked pattern exists in `cancel.c` and `txn.c`, confirming this is a systemic issue.",,
N5,openldap/openldap,519e0c94c9f3804813f691de487283ad7586f510,PROP-N5-npd-101,potential-vulnerability,libraries/libldap/txn.c::ldap_txn_end::L75-80,"Both ldap_txn_end (L75) and ldap_txn_end_s (L108) call ber_alloc_t(LBER_USE_DER) then immediately pass the result to ber_printf without a null check; ber_alloc_t returns NULL on LBER_CALLOC failure (confirmed in liblber/io.c:269-272), and ber_printf asserts ber != NULL (encode.c:511) — crashing in debug or dereferencing NULL in NDEBUG release. passwd.c in the same library correctly checks ber == NULL and returns LDAP_NO_MEMORY (passwd.c:99-102), confirming this is an unintentional omission in txn.c.","An attacker causes memory exhaustion on the LDAP client or proxy (e.g., by flooding large server responses), then triggers a transaction end operation; ber_alloc_t returns NULL, ber_printf dereferences it, crashing the process (DoS).",,
N5,openldap/openldap,519e0c94c9f3804813f691de487283ad7586f510,PROP-N5-npd-109,potential-vulnerability,libraries/libldap/vlvctrl.c::ldap_create_vlv_control::L207-231,"The function `ldap_create_vlv_control` checks only `ctrlp == NULL` (L215) but immediately dereferences `ld` at L216 (`ld->ld_errno = LDAP_PARAM_ERROR`) and L220 without any NULL guard on `ld`. The sibling function `ldap_create_vlv_control_value` (L94) correctly guards with `if ( ld == NULL || ... )` before any dereference, proving the library authors intended to handle NULL `ld` — making this omission an inconsistency and a real null pointer dereference defect.","A caller invoking `ldap_create_vlv_control(NULL, vlvinfop, ctrlp)` — e.g., a server-side component that fails to properly initialize the LDAP session handle before processing a VLV search request — crashes at L216 or L220, enabling remote denial of service.",,
N5,openldap/openldap,519e0c94c9f3804813f691de487283ad7586f510,PROP-N5-npd-125,potential-vulnerability,libraries/liblunicode/ucdata/ucpgba.c::_add_run::L129-137,"Multiple unchecked malloc() returns are immediately dereferenced in _add_run (L129-130: run->visual_next after malloc, L135-137: run->chars/positions after second malloc) and ucstring_create (L326-331: str->cursor_motion after malloc), with no NULL guards. Separately, ucstring_cursor_info (L735-737) dereferences str->cursor without a NULL check: ucstring_create returns a valid ucstring_t with cursor==0 when start==end (early return at L342 skips the L430 cursor initialisation), so any subsequent cursor call on that empty-string object NPDs.","An attacker sending LDAP requests that cause the bidirectional text library to process an empty string (start==end) and then invoke a cursor function (ucstring_cursor_right/left/info) will trigger a NULL dereference crash in the OpenLDAP process, achieving denial of service; allocation-failure paths in _add_run and ucstring_create provide additional NPD vectors under memory pressure.",,
N5,openldap/openldap,519e0c94c9f3804813f691de487283ad7586f510,PROP-N5-npd-141,potential-vulnerability,libraries/liblutil/ntservice.c::lutil_LogStartedEvent::L387-406,"Multiple unchecked return values lead to null pointer dereferences: (1) `RegisterEventSource` at L393 returns NULL on failure, but `hEventLog` is passed directly to `ReportEvent` at L400 without a null guard; the same pattern exists in `lutil_LogStoppedEvent` at L414-416. (2) `malloc(20)` at L395 is not checked before `itoa(slap_debug, Inserts[i], 10)` at L396, allowing a null deref on OOM. (3) `RegisterServiceCtrlHandler` at L424 is not checked before `SetServiceStatus(hlutil_ServiceStatus, ...)` at L437.","If the Windows Event Log service is unavailable or system resources are exhausted, `RegisterEventSource` returns NULL; the unchecked NULL HANDLE is then passed to `ReportEvent`, causing undefined behavior or a crash (DoS) of the OpenLDAP NT service during startup or shutdown.",,
N5,openldap/openldap,519e0c94c9f3804813f691de487283ad7586f510,PROP-N5-npd-149,potential-vulnerability,libraries/liblutil/utils.c::lutil_str2bin::L886-904,"In `lutil_str2bin`, the decimal-path branch allocates a temporary buffer via `ber_memalloc_x(out->bv_len, ctx)` at L887 but never checks the return value for NULL before passing it to `scale()` at L904. Inside `scale`, `memset(tmp, 0, prev->bufsiz)` immediately dereferences the pointer unconditionally, causing a NULL dereference crash if the allocation fails. All other pointer dereferences in the file are either guarded (lutil_parsetime, lutil_strcopy/strncopy) or callers demonstrably pass stack-local addresses (lutil_tm2time, lutil_tm2gtime, lutil_atoix family).","An LDAP client sends an ADD/MODIFY request with a large decimal integer attribute value exceeding 64 digits (e.g., serialNumber or INTEGER syntax field), causing `lutil_str2bin` in `schema_init.c` to request a heap allocation; if the server is under memory pressure and the allocation fails, the unchecked NULL pointer is passed to `scale()` which dereferences it via `memset`, crashing the slapd process (DoS).",,
N5,openldap/openldap,519e0c94c9f3804813f691de487283ad7586f510,PROP-N5-npd-021,potential-vulnerability,libraries/liblber/memory.c::ber_bvreplace_x::L702-715,"The property fails at ber_bvreplace_x (L707-711): after calling ber_memrealloc_x (L708), the return value is stored directly into dst->bv_val without a NULL check; if allocation fails, ber_memrealloc_x returns NULL, and the unconditional AC_MEMCPY(dst->bv_val, ...) at L711 becomes memcpy(NULL, ...) — a null pointer dereference causing a crash. Every other allocating function in this file (e.g., ber_dupbv_x L505-508) checks for NULL and returns early; ber_bvreplace_x omits this guard, making the gap non-intentional.","An attacker sends many large LDAP Modify requests to exhaust slapd heap memory, then a follow-up Modify or schema-check operation triggers ber_bvreplace_x with a src larger than the existing dst buffer; ber_memrealloc_x returns NULL under heap exhaustion, and the subsequent memcpy(NULL, ...) segfaults slapd — achieving remote denial of service.",,
N5,openldap/openldap,519e0c94c9f3804813f691de487283ad7586f510,PROP-N5-npd-077,potential-vulnerability,libraries/liblutil/sasl.c::lutil_sasl_freedefs::L48-63,"lutil_sasl_freedefs relies solely on assert(defs!=NULL) (L53) to guard against NULL dereference at L55; assert is a no-op in release/NDEBUG builds. Two callers — clients/tools/common.c:1526 and clients/tools/ldapvc.c:387 — call lutil_sasl_freedefs(defaults) unconditionally without checking the NULL return from lutil_sasl_defaults, creating a reachable null dereference when ber_memalloc fails. Additionally, interaction::L195 dereferences defaults->resps without a null check, reachable when flags==LDAP_SASL_INTERACTIVE and defaults==NULL (same OOM path) and the user enters non-empty input.","An attacker-induced or system-level memory exhaustion causes ber_memalloc to return NULL inside lutil_sasl_defaults; clients/tools/common.c passes the NULL return directly to the SASL bind and then to lutil_sasl_freedefs, crashing the LDAP client process. With LDAP_SASL_INTERACTIVE mode, the same NULL defaults pointer reaches interaction::L195 and causes a null dereference on defaults->resps.",,
N5,openldap/openldap,519e0c94c9f3804813f691de487283ad7586f510,PROP-N5-npd-085,potential-vulnerability,libraries/libldap/t61.c::ldap_t61s_valid::L324-333,"All three public functions (ldap_t61s_valid, ldap_t61s_to_utf8s, ldap_utf8s_to_t61s) dereference their struct berval* arguments at their first line of code with no prior null check, so passing NULL for str/src/dst causes an immediate null pointer dereference. Proof of safety fails at input validation — none of the functions guard against NULL berval pointers or NULL bv_val fields when bv_len > 0. However, exhaustive grep across the entire repository finds zero callers of these functions, making them effectively dead code in the current codebase; reachability from external LDAP input is not established.","An external application or module that links against libldap and calls ldap_t61s_valid, ldap_t61s_to_utf8s, or ldap_utf8s_to_t61s with a NULL berval pointer (or a berval with bv_len > 0 and bv_val == NULL) would trigger a null pointer dereference and crash; within the audited slapd codebase no such call path exists.",,
N5,openldap/openldap,519e0c94c9f3804813f691de487283ad7586f510,PROP-N5-npd-118,potential-vulnerability,libraries/liblmdb/mtest2.c::main::L43-46,"malloc() at line 43 is not checked for NULL before values[i] is first dereferenced at line 46; if malloc fails, this is an immediate null pointer dereference. However, mtest2.c is a standalone test utility (not part of the LDAP server), so external LDAP attackers cannot reach this code path, and the allocation size (~64–447 ints) is small enough that malloc failure is extremely unlikely in practice.","An operator running the mtest2 standalone binary in a severely memory-constrained environment would trigger a NULL dereference at line 46 (values[i] = rand()%1024) when malloc returns NULL, causing a crash; this is not reachable via LDAP.",,
