project_id,repo,commit,property_id,classification,code_path,proof_trace,attack_scenario,result,reason
N5,openldap/openldap,519e0c94c9f3804813f691de487283ad7586f510,PROP-N5-npd-001,potential-vulnerability,clients/tools/common.c::tool_print_ctrls::L2694-2698,"Three unchecked allocation sites dereference NULL on malloc/ber_memalloc failure: (1) tool_print_ctrls L2694 `ptr = str = malloc(len+1)` immediately followed by unconditional `lutil_strcopy(ptr, ctrls[i]->ldctl_oid)` at L2698 with no NULL guard; (2) print_prepostread L2004 `str = malloc(...)` followed by `lutil_strncopy(ptr=str, ...)` at L2007; (3) print_paged_results L2078 `ptr = ber_memalloc(...)` followed by `strcpy(ptr, buf)` at L2081. All three are genuine null pointer dereferences that crash the client tool on allocation failure.","An attacker-operated malicious LDAP server sends responses containing many or large control values to exhaust the connecting client's heap; when tool_print_ctrls is subsequently invoked to display a server control, malloc(len+1) returns NULL, and the unchecked pointer is passed directly to lutil_strcopy, causing a null pointer dereference crash (client-side DoS).",,
N5,openldap/openldap,519e0c94c9f3804813f691de487283ad7586f510,PROP-N5-npd-113,potential-vulnerability,libraries/liblmdb/mdb_dump.c::main::L281-283,"The return value of malloc(key.mv_size+1) at L281 is never checked before use: if malloc returns NULL (memory pressure, or integer overflow when mv_size is near SIZE_MAX), the memcpy at L282 and the indexed write at L283 dereference NULL. No other null pointer dereferences exist in the file; all other pointer uses are stack-allocated structs or LMDB API results guarded by error checks. Attack reachability via LDAP is not direct — mdb_dump is a standalone admin CLI tool, not the slapd daemon.","An operator running 'mdb_dump -a' on a database under memory exhaustion (or with a specially crafted key whose mv_size is near SIZE_MAX) triggers malloc failure, causing memcpy(NULL, ...) to segfault and crash the dump utility.",,
N5,openldap/openldap,519e0c94c9f3804813f691de487283ad7586f510,PROP-N5-npd-121,potential-vulnerability,libraries/liblmdb/mtest5.c::main::L46-49,"The return value of malloc() at line 46 is never checked for NULL before values[] is first dereferenced at line 49 (and subsequently at lines 69, 70, 96, 97). All LMDB API calls are guarded by the E() macro which aborts on failure, but malloc is not, leaving a gap in the proof. External reachability via LDAP is incorrect — mtest5.c is a standalone test binary with no network I/O, so exploitation requires direct execution under memory pressure.","A process running mtest5 on a memory-constrained system receives NULL from malloc at line 46; the immediately following loop at line 49 (values[i] = rand()%1024) dereferences NULL, causing a crash. Direct LDAP attacker triggering is not possible as this is a standalone test utility.",,
N5,openldap/openldap,519e0c94c9f3804813f691de487283ad7586f510,PROP-N5-npd-129,potential-vulnerability,libraries/liblunicode/utbm/utbm.c::utbm_create_pattern::L231-239,"Two unchecked malloc paths produce definite null pointer dereferences on OOM: (1) utbm_create_pattern L236-237 calls malloc then immediately passes the result to memset without a null check; (2) utbm_compile L289-296 stores malloc/realloc results into p->pat and p->skip without null checks, then L304 initializes cp=p->pat and L332/L356 write cp->uc unconditionally. The proof that the property holds fails at both allocation sites because no guard prevents the NULL dereference.","An attacker triggers repeated LDAP substring search requests to exhaust server memory; when the LDAP server calls utbm_create_pattern or utbm_compile under OOM and malloc returns NULL, the subsequent memset or field write dereferences NULL, crashing the slapd process (DoS).",,
N5,openldap/openldap,519e0c94c9f3804813f691de487283ad7586f510,PROP-N5-npd-145,potential-vulnerability,libraries/liblutil/sasl.c::interaction::L192-196,"In `interaction()`, the switch block explicitly guards `defaults` with `if (defaults)` checks (lines 117–127), confirming the function accepts NULL `defaults`. However, at lines 195–196, `ldap_charray_add(&defaults->resps, ...)` and `defaults->resps[defaults->nresps++]` are accessed without any null check — a NULL dereference if `defaults == NULL`. This path is reachable when `lutil_sasl_defaults()` returns NULL (OOM) and the unchecked return value is passed by callers (`common.c:1499`, `ldapvc.c:361`) to `lutil_sasl_interact()` with `LDAP_SASL_INTERACTIVE` flags.","Under memory pressure, `lutil_sasl_defaults()` returns NULL; callers in `common.c` and `ldapvc.c` pass this NULL directly as `defaults` to `ldap_sasl_interactive_bind()` with `LDAP_SASL_INTERACTIVE` flag; when the SASL library prompts and the user enters non-empty input, `interaction()` crashes at line 195 dereferencing NULL, causing a denial-of-service in the LDAP client or any server component using interactive SASL binding.",,
N5,openldap/openldap,519e0c94c9f3804813f691de487283ad7586f510,PROP-N5-npd-161,potential-vulnerability,libraries/librewrite/session.c::rewrite_session_var_get::L291-293,"`rewrite_session_var_get` at L293 calls `strdup(var->lv_value.bv_val)` with no null check on `bv_val`; `bv_val` can become NULL when `rewrite_var_replace` (called at session.c:L233 via `(void)rewrite_var_replace(...)`) frees the old value then fails to strdup the new one under OOM, setting `bv_val = NULL` in the AVL tree entry and returning -1 — a return value that `rewrite_session_var_set_f` silently discards. A subsequent get on the same session variable then passes NULL to strdup, which is undefined behavior and a crash on all common platforms.","An LDAP client that triggers a rewrite rule using session variables (REWRITE_MAP_SET_SESN_VAR followed by REWRITE_MAP_GET_SESN_VAR on the same variable name) can reach this path: if server memory is exhausted at the moment a session variable is updated with a longer value, the old `bv_val` is freed and `strdup` returns NULL, corrupting the in-tree var; a follow-up GET request for the same session variable then calls `strdup(NULL)` in `rewrite_session_var_get::L293`, crashing slapd.",,
N5,openldap/openldap,519e0c94c9f3804813f691de487283ad7586f510,PROP-N5-npd-017,potential-vulnerability,libraries/liblber/encode.c::ber_put_berval::L253-263,"The guard at L258 (`if (bv==NULL || bv->bv_len==0)`) does not check `bv->bv_val`; if `bv->bv_val==NULL` with `bv->bv_len>0`, the function calls `ber_put_ostring(ber, NULL, bv->bv_len, tag)` (L262), which then calls `ber_write(ber, NULL, len, 0)` (io.c L121: `AC_MEMCPY(*p, buf=NULL, len)`) — a null pointer dereference. The same unguarded path is reachable from `ber_printf` case 'O' (L568-570), which only tests `bv==NULL` before dispatching. The `assert(buf!=NULL)` inside `ber_write` is debug-only and absent in production builds.","Under memory pressure, `ber_get_stringbv` (LBER_BV_ALLOC) sets `bv->bv_len` from attacker-supplied network data before malloc, then returns LBER_DEFAULT with `bv_val=NULL`; if a caller on this path ignores the error and passes the half-initialized berval to encoding (e.g., during LDAP Add/Modify response construction), `ber_put_berval` crashes the server via a null-source `memcpy`.",,
N5,openldap/openldap,519e0c94c9f3804813f691de487283ad7586f510,PROP-N5-npd-025,potential-vulnerability,libraries/liblber/stdio.c::ber_pvt_fputs::L114-121,"The EBCDIC-path `ber_pvt_fputs` (which replaces stdlib `fputs` via `#define fputs ber_pvt_fputs`) performs `strncpy(buf, str, sizeof(buf))` at L118 without any NULL check on `str`; the only caller-side guard is `assert(data != NULL)` in `ber_error_print` (bprint.c:75), which is a no-op in release builds compiled with `-DNDEBUG`. Similarly, `ber_pvt_vsnprintf` (EBCDIC, L147) calls `strchr(ptr, '%')` where `ptr = fmt` with no NULL guard on `fmt`. The proof that no null dereference occurs therefore depends entirely on callers never passing NULL, which is not enforced at runtime in production builds.","On z/OS (HAVE_EBCDIC) in a release build, an LDAP client triggers an error path in OpenLDAP that results in a logging or print call with an un-checked (potentially NULL) string argument; `fputs(NULL, fp)` maps to `ber_pvt_fputs(NULL, fp)` where `strncpy(buf, NULL, sizeof(buf))` dereferences the null pointer, crashing the LDAP server process (denial of service).",,
N5,openldap/openldap,519e0c94c9f3804813f691de487283ad7586f510,PROP-N5-npd-033,potential-vulnerability,libraries/libldap/bind.c::ldap_bind::L79,"Neither ldap_bind() nor ldap_bind_s() contains an assert or null check for the `ld` parameter before dereferencing ld->ld_errno in the default/SASL branch (L79 and L115 respectively). Contrast with ldap_simple_bind() in sbind.c which guards with assert(ld != NULL) at L70. Proof fails: if ld is NULL and authmethod is not LDAP_AUTH_SIMPLE, the dereference is unconditional and will crash.","An application that fails to check the return value of ldap_init() (which returns NULL on allocation failure) and then calls ldap_bind(NULL, dn, passwd, LDAP_AUTH_SASL) or an unknown authmethod will trigger a null pointer dereference crash; an attacker able to exhaust memory or influence authmethod selection at the application level can trigger a denial-of-service.",,
N5,openldap/openldap,519e0c94c9f3804813f691de487283ad7586f510,PROP-N5-npd-041,potential-vulnerability,libraries/libldap/deref.c::ldap_create_deref_control::L108-131,"Two public API functions fail the null-pointer proof: `ldap_create_deref_control` (L117, L121) and `ldap_parse_deref_control` (L267, L274, L281) both dereference the `ld` parameter without any prior NULL check, inconsistent with sibling functions `ldap_create_deref_control_value` (L40) and `ldap_parse_derefresponse_control` (L170) which explicitly guard against `ld == NULL`. Additionally, `ldap_create_deref_control_value` (L74) reads `ds[i].attributes[j]` where a NULL `attributes` pointer would cause a NPD at the loop-condition dereference. Attack reachability for the `ld == NULL` paths requires an application to propagate a NULL LDAP handle, which is possible in error-recovery paths since these are exported library functions with no documented NULL-`ld` precondition.","A libldap consumer that calls `ldap_parse_deref_control(NULL, ctrls, &drp)` — e.g., after a failed or freed LDAP handle — triggers a null pointer dereference at L267 (`ld->ld_errno = LDAP_PARAM_ERROR`) before any validation occurs, crashing the process; an LDAP server that sends a malformed deref response can force the client down this path if the client does not check the handle before calling the parse function.",,
N5,openldap/openldap,519e0c94c9f3804813f691de487283ad7586f510,PROP-N5-npd-057,potential-vulnerability,libraries/libldap/ldif.c::ldif_open_mem::L753-755,"ldif_open_mem calls ber_memalloc at L753 but, unlike the analogous ldif_open function (L731-734), does not check for NULL before dereferencing lfp at L755 (lfp->fp = fp); if the allocation fails under OOM conditions this is a null pointer dereference crash. All other functions in the file that allocate memory (ldif_open, ldif_parse_line2, ldif_read_record, ldif_must_b64_encode_register) correctly guard their allocations, making this an isolated omission. The function is exported in ldap.map and ldif.h as a public API but has no internal callers in this codebase.","An application using libldap directly that calls ldif_open_mem under memory pressure (OOM) will crash at L755 with a null pointer dereference, enabling a denial-of-service against any process that uses this API entry point.",,
N5,openldap/openldap,519e0c94c9f3804813f691de487283ad7586f510,PROP-N5-npd-065,potential-vulnerability,libraries/libldap/os-ip.c::ldap_pvt_connect::L428-433,"In the LDAP_CONNECTIONLESS UDP path of ldap_pvt_connect (L431), ldap_memcalloc() is called and its result stored directly to ld->ld_options.ldo_peer with no NULL check; the very next line (L432) passes ldo_peer as the destination of AC_MEMCPY, dereferencing NULL if allocation fails. No guard exists between the assignment and the memcpy.","When LDAP_CONNECTIONLESS is compiled in, an attacker that induces OOM (e.g., via memory exhaustion from many concurrent CLDAP/UDP connections) triggers the NULL-return from ldap_memcalloc, causing AC_MEMCPY to write to address 0 and crash the process (DoS via null pointer dereference).",,
N5,openldap/openldap,519e0c94c9f3804813f691de487283ad7586f510,PROP-N5-npd-081,vulnerability,libraries/libldap/sort.c::ldap_sort_entries::L141-142,"In `ldap_sort_entries`, when `attr == NULL` (sort by DN), `ldap_get_dn()` at L141 can return NULL on BER decoding failure of a malformed entry. This NULL `dn` is passed unchecked to `ldap_explode_dn(dn, 1)` at L142, which internally calls `ldap_str2dn(NULL, ...)` (getdn.c:682-684) — hitting `assert(str != NULL)` in debug builds or `strlen(NULL)` in release builds, causing a crash. No NULL check on the return value of `ldap_get_dn` exists before its use.","An attacker controls or MITMs an LDAP server and returns a search result entry with a BER-malformed DN. When the LDAP client calls `ldap_sort_entries(ld, &res, NULL, strcasecmp)` (as done in ldapsearch.c:1793), `ldap_get_dn` returns NULL, the NULL is passed to `ldap_explode_dn`, and the resulting `strlen(NULL)` crashes the client process (DoS).",,
N5,openldap/openldap,519e0c94c9f3804813f691de487283ad7586f510,PROP-N5-npd-009,potential-vulnerability,clients/tools/ldapurl.c::main::L288-291,"In the 'E' option handler, the return value of realloc() is assigned directly to lud.lud_exts without a NULL check, then lud.lud_exts[nexts++] is dereferenced unconditionally on the next line. If realloc fails and returns NULL, this results in a null pointer dereference (SIGSEGV). All other pointer dereferences in the file are properly guarded; this is the sole unguarded case.","An attacker invoking ldapurl with many -E extension arguments on a memory-constrained system can trigger the realloc failure path, causing ldapurl to crash (DoS via null pointer dereference at L290).",,
N5,openldap/openldap,519e0c94c9f3804813f691de487283ad7586f510,PROP-N5-npd-097,potential-vulnerability,libraries/libldap/tls_g.c::tlsg_ctx_init::L197-200,"In `tlsg_ctx_init`, the result of `ldap_str2charray(lt->lt_cacertdir, CERTPATHSEP)` at L198 is stored in `dirs` without any NULL check; the subsequent loop `for (i=0; dirs[i]; i++)` at L200 immediately dereferences `dirs`, causing a null pointer dereference if `ldap_str2charray` returns NULL (e.g., on OOM or if `lt->lt_cacertdir` is NULL while `lo->ldo_tls_cacertdir` is non-NULL). The apparent null-name risk in `tlsg_session_chkhost` (L600-637) is mitigated by the explicit NULL-to-localhost guard in the caller (`tls2.c:1126-1129`); nearly all other dereferences in the file are properly guarded.","An LDAP daemon configured with `TLSCACertificatePath` that encounters memory exhaustion (OOM) during TLS context initialization will reach `ldap_str2charray` returning NULL; the unguarded `dirs[i]` dereference then crashes the process, yielding a denial of service reachable via any LDAP TLS connection attempt that triggers context setup.",,
N5,openldap/openldap,519e0c94c9f3804813f691de487283ad7586f510,PROP-N5-npd-114,potential-vulnerability,libraries/liblmdb/mdb_load.c::main::L354-386,"Two `malloc` calls in `main()` have no NULL return-value checks: `dbuf.mv_data = malloc(dbuf.mv_size)` at L354 is dereferenced via `fgets(dbuf.mv_data, ...)` inside `readhdr()` at L73 if malloc fails; `kbuf.mv_data = malloc(kbuf.mv_size * 2)` at L384 is used immediately at L386 in pointer arithmetic `(char *)kbuf.mv_data + kbuf.mv_size`, which is undefined behaviour when the pointer is NULL. No intervening null check exists on either path.","An attacker who can exhaust process memory before `mdb_load` is invoked (e.g., concurrent memory pressure on a low-memory host where mdb_load is used to import LDAP database content) causes `malloc` to return NULL; the subsequent null pointer dereference crashes the process (denial of service).",,
N5,openldap/openldap,519e0c94c9f3804813f691de487283ad7586f510,PROP-N5-npd-122,potential-vulnerability,libraries/liblmdb/mtest6.c::main::L55-78,"The return value of `calloc` at line 55 is never checked for NULL before being passed to `sprintf` at lines 64, 71, and 78; if allocation fails the subsequent writes through `sval` constitute a null pointer dereference. The second code_scope location (line 96, `rand`) is inside a `#if 0` dead-code block and is not compiled. Attack reachability via LDAP is not established: `mtest6.c` is a standalone test binary with no network interface and is not linked into the LDAP server.","On a system running the mtest6 test binary under memory pressure, an OOM allocation failure causes `calloc` to return NULL; the subsequent `sprintf(sval, ...)` call dereferences NULL, crashing the process. Requires local access and the test binary to be executing; not reachable via external LDAP traffic.",,
N5,openldap/openldap,519e0c94c9f3804813f691de487283ad7586f510,PROP-N5-npd-154,potential-vulnerability,libraries/librewrite/info.c::rewrite_session::L222-240,"In `rewrite_session`, when the requested context is not found and `li_rewrite_mode == REWRITE_MODE_USE_DEFAULT`, a second lookup for the default context is performed at L222-225, but the return value is not checked for NULL before being passed to `rewrite_context_apply` at L240. Inside `rewrite_context_apply` (context.c:226), `context->lc_rule` is unconditionally dereferenced; the only guard is `assert(context != NULL)` at context.c:212, which is a no-op in release builds (NDEBUG), leaving a real null pointer dereference path.","An LDAP client sends a request triggering the rewrite engine with a context name absent from the configuration; if slapd is configured with `REWRITE_MODE_USE_DEFAULT` and the default context is concurrently freed (race during `rewrite_info_delete`) or never successfully inserted (OOM during init of a second rewrite_info instance), `rewrite_context_apply` dereferences a null context pointer at context.c:226, crashing the LDAP server process.",,
N5,openldap/openldap,519e0c94c9f3804813f691de487283ad7586f510,PROP-N5-npd-018,potential-vulnerability,libraries/liblber/etest.c::main::L96-103,"Two concrete NULL-deref paths exist. (1) `ber_sockbuf_add_io(sb, ...)` is called at L97-98 before the `if (sb == NULL)` check at L100; `ber_sockbuf_add_io` dereferences `sb` at sockbuf.c:187 (`q = &sb->sb_iod`), so if `ber_sockbuf_alloc()` fails the null check fires too late. (2) `getbuf()` returns NULL on stdin EOF (L56) but callers at L128-129, L142-143, and L151-152 pass the result directly to `atoi()` or `strlen()` without a null guard, causing undefined behavior/SIGSEGV. Classification is potential-vulnerability rather than confirmed because etest.c is a test binary (not the LDAP daemon), making production reachability context-dependent.","An attacker or user with access to run the `etest` binary uses format specifier 'i' and closes stdin immediately; `getbuf()` returns NULL and `atoi(NULL)` dereferences a null pointer causing a crash. Alternatively, if `ber_sockbuf_alloc()` fails under memory pressure, `ber_sockbuf_add_io` is called with `sb=NULL` and crashes at the first field access.",,
N5,openldap/openldap,519e0c94c9f3804813f691de487283ad7586f510,PROP-N5-npd-002,potential-vulnerability,clients/tools/ldapcompare.c::main::L215-228,"The property fails at two allocation sites in `main()`: (1) `strdup(sep)` at L216 is used in `strlen(bvalue.bv_val)` at L217 without a NULL check; (2) `malloc(strlen(&sep[1]))` at L221 is passed directly to `lutil_b64_pton` as the write-destination buffer at L222 without a NULL check. Both allocation failures require OOM to trigger, which is not directly controllable via CLI argument content alone.","If system memory is exhausted while ldapcompare processes a user-supplied `attr:value` or `attr::b64value` argument, the unchecked NULL return from `strdup`/`malloc` propagates into `strlen(NULL)` or a write through a NULL pointer in `lutil_b64_pton`, causing an immediate process crash (segfault).",,
N5,openldap/openldap,519e0c94c9f3804813f691de487283ad7586f510,PROP-N5-npd-034,potential-vulnerability,libraries/libldap/cancel.c::ldap_cancel::L48-49,"`ber_alloc_t(LBER_USE_DER)` can return NULL on allocation failure (io.c:271-273), but both `ldap_cancel` (L48-49) and `ldap_cancel_s` (L68-69) pass the result directly to `ber_printf()` without a NULL check; `ber_printf` asserts `ber != NULL` (encode.c:511) which is compiled out in release builds, leaving a NULL dereference. Comparable functions in the same library (`passwd.c:99-102`, `dds.c:104-107`) correctly guard against this with an explicit NULL check and `LDAP_NO_MEMORY` return.","An attacker or system condition causing memory exhaustion on an LDAP client or proxy host triggers OOM in `ber_alloc_t`, causing `ldap_cancel`/`ldap_cancel_s` to pass NULL to `ber_printf`, resulting in a NULL pointer dereference and process crash (DoS).",,
N5,openldap/openldap,519e0c94c9f3804813f691de487283ad7586f510,PROP-N5-npd-058,potential-vulnerability,libraries/libldap/ldifutil.c::ldap_ldif_record_done::L64-83,"In `ldap_ldif_record_done` (L78-79), `lr->lr_freeval[i]` is dereferenced inside a loop without a NULL guard on `lr->lr_freeval`. The invariant fails when `ldap_parse_ldif_record_x` sets `lr->lr_lines` via `ldif_countlines` (L135) then returns LDAP_NO_MEMORY via early `return` (L138) before ever setting `lr_freeval`, leaving `lr_lines > 0` and `lr_freeval == NULL`. Callers such as `ldapmodify.c:453` call `ldap_ldif_record_done` unconditionally after any return code, triggering the NPD.","An attacker supplies a multi-line LDIF record to `ldapmodify` while causing (or waiting for) memory pressure so that `ber_memcalloc_x` fails; `ldapmodify.c` unconditionally calls `ldap_ldif_record_done`, which crashes at the NULL `lr_freeval` dereference, producing a denial-of-service.",,
N5,openldap/openldap,519e0c94c9f3804813f691de487283ad7586f510,PROP-N5-npd-074,potential-vulnerability,libraries/libldap/request.c::find_connection::L693-696,"In find_connection (L694-696), lcu = lc->lconn_server is immediately dereferenced via lcu->lud_scheme and lcu->lud_port with no null guard. A connection with lconn_server == NULL can enter ld->ld_conns when ldap_new_connection is called with connect=0 (open.c L351, L586 for pre-existing-socket paths); LDAP_CALLOC zero-initializes lconn_server and it is never assigned when connect==0 with url==NULL. The contrast is direct: ldap_dump_connection (L852) guards if (lc->lconn_server != NULL) before the same field, proving the developer knows it can be NULL, yet find_connection omits this guard.","A client or proxy using ldap_initialize_fd(fd, LDAP_PROTO_TCP, NULL) (no URL) establishes a connection with lconn_server=NULL in ld->ld_conns; when a malicious upstream LDAP server sends a referral response, ldap_chase_v3referrals calls find_connection which dereferences lcu->lud_scheme with lcu==NULL, causing a SIGSEGV crash.",,
N5,openldap/openldap,519e0c94c9f3804813f691de487283ad7586f510,PROP-N5-npd-082,potential-vulnerability,libraries/libldap/sortctrl.c::ldap_parse_sortresponse_control::L512,"The function validates `ctrl != NULL` at L503–506 but does not check `ctrl->ldctl_oid` for NULL before passing it to `strcmp` at L512; if an LDAPControl with a NULL OID is passed (manually constructed or from malformed server data), this dereferences NULL and crashes. Additionally, `ldap_create_sort_keylist` guards its `sortKeyList` and `keyString` parameters only with `assert()` (L191–192) rather than runtime NULL checks, unlike sibling functions (e.g., `ldap_create_sort_control_value` uses `if (ld == NULL) return LDAP_PARAM_ERROR`), meaning any NULL argument causes a crash in NDEBUG builds.","An attacker performing MITM on plaintext LDAP, or acting as a malicious server, sends a sort response control that induces a NULL `ldctl_oid` in the parsed LDAPControl; alternatively, application code forwarding an incomplete LDAPControl with `ldctl_oid = NULL` to `ldap_parse_sortresponse_control` triggers the null dereference at L512, crashing the LDAP client process.",,
N5,openldap/openldap,519e0c94c9f3804813f691de487283ad7586f510,PROP-N5-npd-098,potential-vulnerability,libraries/libldap/tls_o.c::tlso_verify_cb::L1536-1545,"OpenSSL documents X509_STORE_CTX_get_current_cert() as returning NULL when no certificate is relevant to the verification error; the code at L1536 does not check for NULL before passing cert to X509_get_subject_name(cert) at L1544 and X509_get_issuer_name(cert) at L1545, both of which dereference the pointer internally. A secondary unchecked NULL dereference exists in BIO_meth_new (L140-144, pre-1.1 only) where LDAP_MALLOC's result is used immediately without a NULL guard.","An attacker acting as a TLS peer (server or client) presents a certificate chain that triggers an OpenSSL verification error condition where X509_STORE_CTX_get_current_cert() returns NULL; the resulting call to X509_get_subject_name(NULL) in tlso_verify_cb crashes the OpenLDAP process, causing denial of service.",,
