project_id,repo,commit,property_id,classification,code_path,proof_trace,attack_scenario,result,reason
N5,openldap/openldap,519e0c94c9f3804813f691de487283ad7586f510,PROP-N5-npd-126,potential-vulnerability,libraries/liblunicode/ucstr.c::UTF8bvnormalize::L239-265,"UTF8bvnormalize (L239) calls uccompatdecomp without checking its return value; on OOM, uccompatdecomp sets ucsout=NULL and returns -1 (ucdata.c:944-946). The non-approx else-branch then calls uccanoncomp(NULL, -1) (ucdata.c:677), which unconditionally dereferences str[0] before any length guard, causing a NULL pointer dereference crash. UTF8bvnormcmp has the identical pattern at L422 and L441 for both ucsout1 and ucsout2.","An attacker sends LDAP search or compare requests referencing non-ASCII Unicode attribute values (e.g., cn with multibyte chars) under memory-pressure conditions; the server's string normalization path (schema_init.c:1896) calls UTF8bvnormalize, which calls uccompatdecomp; on allocation failure uccanoncomp dereferences a NULL pointer and crashes slapd (DoS).",,
N5,openldap/openldap,519e0c94c9f3804813f691de487283ad7586f510,PROP-N5-npd-150,vulnerability,libraries/liblutil/uuid.c::lutil_uuidstr::L364-377,"`lutil_eaddr()` returns NULL on multiple error paths (sysctl failure, malloc failure, no matching Ethernet interface); the result is assigned to `nl` at line 364 but there is no NULL check before `nl[0]`..`nl[5]` are dereferenced in the snprintf call at lines 375-377 (the fallback `#else` branch). No guard exists anywhere in the call chain to prevent the dereference.","An LDAP client sends an Add request; `servers/slapd/add.c:651` calls `lutil_uuidstr()` on a platform using the fallback branch; if the OS sysctl/socket call fails (e.g., resource exhaustion or no Ethernet interface) `lutil_eaddr()` returns NULL and the subsequent `nl[0]` dereference crashes the slapd process (DoS).",,
N5,openldap/openldap,519e0c94c9f3804813f691de487283ad7586f510,PROP-N5-npd-030,potential-vulnerability,libraries/libldap/apitest.c::main::L144,"The IETF C LDAP API spec (confirmed in the codebase) explicitly states ldapai_vendor_name 'may be set to NULL if no name is available'; in options.c:171, LDAP_STRDUP can return NULL on OOM and that failure is silently swallowed (rc stays LDAP_OPT_SUCCESS), so ldap_get_option returns success with a NULL vendor_name. apitest.c line 144 passes api.ldapai_vendor_name to printf(""%s"") without any NULL guard, which is undefined behaviour per C standard — inconsistent with how ldapai_extensions is guarded at line 102.","A low-memory environment where LDAP_STRDUP fails for LDAP_VENDOR_NAME causes ldap_get_option to silently return NULL in ldapai_vendor_name; the subsequent printf at line 144 invokes undefined behaviour that, on C library implementations that dereference the pointer, produces a crash.",,
N5,openldap/openldap,519e0c94c9f3804813f691de487283ad7586f510,PROP-N5-npd-038,potential-vulnerability,libraries/libldap/cyrus.c::ldap_pvt_sasl_cbinding::L416-422,"At line 416, `ldap_memalloc(sizeof(*cb) + plen + cbv.bv_len)` can return NULL on allocation failure; the result is immediately dereferenced at lines 417-422 (`cb->len`, `cb->data`, `cb->name`, `cb->critical`) with no intervening NULL check, breaking the property. A secondary NPD exists in `ldap_pvt_sasl_mutex_new` (L1258) where a NULL return from `LDAP_CALLOC` is passed directly into `ldap_pvt_thread_mutex_init`, which writes to the null address inside that function.","An attacker interacting with an LDAP client that uses SASL channel binding over TLS (SASL_CHANNEL_BINDING enabled) can induce memory pressure (e.g., by consuming server-side resources or via repeated SASL bind handshakes), causing `ldap_memalloc` to return NULL inside `ldap_pvt_sasl_cbinding` and crashing the client process with a null pointer dereference (denial of service).",,
N5,openldap/openldap,519e0c94c9f3804813f691de487283ad7586f510,PROP-N5-npd-046,potential-vulnerability,libraries/libldap/fetch.c::ldif_open_url::L71-82,"At line 71, `p = ber_strdup(urlstr)` can return NULL on allocation failure (OOM), but there is no null check before `p` is passed to `ldap_pvt_hex_unescape(p)` at line 80, which immediately dereferences its argument (`*s != '\0'` at url.c:1625), causing a null pointer dereference. The same NULL `p` would reach `fopen(p, ""rb"")` at line 82, constituting undefined behavior. The proof that the property holds fails at line 80 because the OOM path is unguarded.","An attacker sends a malformed LDAP Modify/Add request containing a URL-valued LDIF attribute (e.g., `< file:/etc/passwd`) to drive slapd into an OOM state; when `ber_strdup` in `ldif_open_url` returns NULL, `ldap_pvt_hex_unescape(NULL)` immediately crashes the slapd process, causing a denial of service.",,
N5,openldap/openldap,519e0c94c9f3804813f691de487283ad7586f510,PROP-N5-npd-054,potential-vulnerability,libraries/libldap/init.c::ldap_int_conf_option::L152-257,"ldap_pvt_conf_option (L259-279) passes its cmd and opt arguments directly to ldap_int_conf_option without null checks. The sole in-tree caller (clients/tools/common.c:866) passes cvalue=NULL when -o KEY is given without =VALUE (strchr returns NULL at L812). Inside ldap_int_conf_option, opt is immediately dereferenced in strcasecmp (L171), strtol (L187/L230/L238), LDAP_STRDUP (L211), or strcasecmp (L200) depending on attribute type, causing a null pointer dereference.","An attacker (or misconfigured script) invoking an LDAP client tool with '-o TIMEOUT' (without '=VALUE') triggers cvalue=NULL, which is forwarded as opt=NULL into ldap_int_conf_option, crashing the process via NPD at strtol(NULL,...) in the ATTR_OPT_TV case (L230). If libldap is embedded in a server application that exposes option-setting to external input, this becomes remotely exploitable.",,
N5,openldap/openldap,519e0c94c9f3804813f691de487283ad7586f510,PROP-N5-npd-062,potential-vulnerability,libraries/libldap/msctrl.c::ldap_create_dirsync_control::L89-114,"In `ldap_create_dirsync_control` (L99) and `ldap_create_extended_dn_control` (L246), the guard checks only `ctrlp == NULL` but immediately dereferences `ld->ld_errno` without first checking `ld == NULL`; if both parameters are NULL the function crashes. This is inconsistent with sibling functions `ldap_create_dirsync_value` and `ldap_parse_dirsync_control` which explicitly handle `ld == NULL` before any dereference, establishing that the library design allows NULL `ld` as an error condition.","An application using libldap that calls `ldap_create_dirsync_control(NULL, ..., NULL)` or `ldap_create_extended_dn_control(NULL, ..., NULL)` — e.g., after a failed `ldap_initialize` that returns NULL — will trigger a null pointer dereference crash (SIGSEGV) at the `ld->ld_errno` assignment.",,
N5,openldap/openldap,519e0c94c9f3804813f691de487283ad7586f510,PROP-N5-npd-103,potential-vulnerability,libraries/libldap/url.c::ldap_url_parsehosts::L1396-1400,"In `ldap_url_parsehosts`, when processing a bracket-format IPv6 host (e.g., `[::1]`), `LDAP_STRDUP(ludp->lud_host+1)` at line 1396 can return NULL on OOM; the result is unconditionally assigned to `ludp->lud_host` at line 1399 without a NULL check. The subsequent `strchr(ludp->lud_host, ']')` at line 1400 then dereferences the potentially-NULL pointer — the guard at line 1401 checks strchr's return value, not the input. The identical pattern at line 1432 (`ldap_pvt_hex_unescape(ludp->lud_host)`) is similarly unguarded.","An attacker-controlled LDAP server address containing a bracket-IPv6 notation (e.g., `[::1]`) is passed to `ldap_url_parsehosts`; under memory pressure the missing post-STRDUP NULL check causes a NULL dereference in `strchr` at L1400, crashing the process (DoS).",,
N5,openldap/openldap,519e0c94c9f3804813f691de487283ad7586f510,PROP-N5-npd-119,potential-vulnerability,libraries/liblmdb/mtest3.c::main::L46-49,"The property fails at line 46: `values = (int *)malloc(count*sizeof(int))` is never checked for NULL before being immediately dereferenced at line 48 (`values[i] = rand()%1024`). All other pointer dereferences (env, txn, cursor, mv_data) are fully guarded by the E()/CHECK() abort macros or loop conditions. The reachability metadata claiming LDAP/network entry is incorrect — mtest3.c is a standalone test binary with no network interface.","If malloc fails under OOM, the code dereferences the NULL `values` pointer at line 48, causing a segfault/crash. However, this is a standalone test utility (not part of the production LDAP server), so exploitation requires local execution under memory pressure rather than a remote network attack.",,
N5,openldap/openldap,519e0c94c9f3804813f691de487283ad7586f510,PROP-N5-npd-015,potential-vulnerability,libraries/liblber/decode.c::ber_skip_tag::L269-279,"`ber_skip_tag` (L269-279) unconditionally executes `ber->ber_ptr = bv.bv_val` and then `ber->ber_tag = *(unsigned char *) ber->ber_ptr` even when `ber_peek_element` returns LBER_DEFAULT. When the BER buffer is exhausted (`ber->ber_ptr == ber->ber_end`), the error path in `ber_tag_and_rest` sets `bv.bv_val = (char *) ber->ber_ptr = ber->ber_end`, so the subsequent deref reads one byte past the end of the allocated BER data buffer. This contrasts with `ber_skip_element` (L225-234) which guards the identical pattern with `if (tag != LBER_DEFAULT)`, confirming the missing guard is a defect rather than intentional design.","An attacker sends a malformed LDAP request where a BER-encoded sequence element terminates exactly at the buffer boundary; `ber_skip_tag` is invoked (e.g., via `ber_first_element` → `ber_scanf` → LDAP message parsing), `ber_peek_element` returns LBER_DEFAULT, and `*(unsigned char *) ber->ber_end` produces a 1-byte heap over-read that can crash the server or leak adjacent heap metadata.",,
N5,openldap/openldap,519e0c94c9f3804813f691de487283ad7586f510,PROP-N5-npd-159,potential-vulnerability,libraries/librewrite/rewrite.c::apply::L52-58,"`rewrite_info_init()` (info.c:63-96) can return NULL on calloc failure, rewrite_context_create failure, or mutex init failure, yet `apply()` in rewrite.c performs no NULL check on the returned `info` pointer before passing it to `rewrite_read()`, `rewrite_param_set()`, `rewrite_session_init()`, and subsequent calls. Contrast with `servers/slapd/overlays/rwm.c:2063-2064` and `back-meta/config.c:545-546`, which correctly guard the return value — confirming the check is intentionally absent in `apply()` rather than by design. Exploiting requires triggering OOM or context-creation failure, making direct attacker control uncertain.","An attacker causing memory exhaustion (e.g., via repeated LDAP requests forcing large allocations) during a configuration reload that exercises the rewrite library could cause `rewrite_info_init` to return NULL; `apply()` would then dereference the NULL pointer at `rewrite_param_set(info, ...)` or `rewrite_session_init(info, ...)`, resulting in a process crash (DoS).",,
N5,openldap/openldap,519e0c94c9f3804813f691de487283ad7586f510,PROP-N5-npd-031,potential-vulnerability,libraries/libldap/assertion.c::ldap_create_assertion_control_value::L26-72,Both `ldap_create_assertion_control_value` (L34) and `ldap_create_assertion_control` (L84) dereference the `ld` parameter (`ld->ld_errno`) without first checking `ld != NULL`. Peer functions in the same library — `psearchctrl.c:87` (`ldap_create_persistentsearch_control_value`) and `sortctrl.c:299` (`ldap_create_sort_control_value`) — both guard with `if (ld == NULL) return LDAP_PARAM_ERROR;` before any dereference. The inconsistency means a NULL `ld` causes an immediate crash in assertion.c where comparable code would return an error code.,"An LDAP client application that fails to verify `ldap_initialize()` returned a non-NULL handle (e.g., due to a connection error or resource exhaustion) and then calls `ldap_create_assertion_control` or `ldap_create_assertion_control_value` will crash at the first `ld->ld_errno` write; an attacker who can induce initialization failure (e.g., by exhausting connections) could trigger application DoS through this path.",,
N5,openldap/openldap,519e0c94c9f3804813f691de487283ad7586f510,PROP-N5-npd-063,potential-vulnerability,libraries/libldap/open.c::ldap_init_fd::L379-381,"In `ldap_init_fd` (LDAP_CONNECTIONLESS/UDP path), `ldap_memcalloc` at L379 can return NULL on OOM, but the result is immediately passed to `getpeername` at L381 as the address buffer without a null check. Passing NULL to `getpeername` is undefined behavior in C; on Linux it returns EFAULT (graceful), but on other platforms it can cause a SIGSEGV crash of the calling process.","A client calling `ldap_init_fd(fd, LDAP_PROTO_UDP, url, &ldp)` under memory pressure causes `ldap_memcalloc` to return NULL, after which `getpeername(fd, NULL, &len)` is invoked — triggering undefined behavior that can crash the process on non-Linux platforms or cause silent UB on Linux.",,
N5,openldap/openldap,519e0c94c9f3804813f691de487283ad7586f510,PROP-N5-npd-007,potential-vulnerability,clients/tools/ldappasswd.c::main::L220-260,"Two NPD patterns exist: (1) At L223 and L248, getpassphrase() return value is passed directly to strdup() without a prior null check — if getpassphrase() returns NULL (non-interactive terminal), strdup(NULL) crashes internally before the intended null guard at L226/L251 is ever reached. (2) At L128→L135 and L143→L150, strdup(optarg) return value is used in strlen() without any null check, so OOM-induced NULL from strdup causes strlen(NULL) UB.","Run `ldappasswd -A < /dev/null` (or in any non-interactive/scripted environment): want_oldpw is set, getpassphrase() returns NULL due to no controlling terminal, strdup(NULL) dereferences NULL inside the C library, crashing the process before the intended null check at L226 is reached. The -S flag triggers the same crash via L248.",,
N5,openldap/openldap,519e0c94c9f3804813f691de487283ad7586f510,PROP-N5-npd-079,vulnerability,libraries/libldap/schema.c::ldap_nameform2bv::L834-836,"`ldap_nameform2bv` calls `print_oids(ss, nf->nf_at_oids_must)` at L836 without a NULL guard, while all other callers of `print_oids` guard with `if (field) { ... }`. `nf->nf_at_oids_must` can be NULL when `ldap_str2nameform` parses a MUST clause with empty parens (`MUST ()`): `parse_oids` returns NULL via the TK_RIGHTPAREN branch (L1365-1369) without modifying `*code`, so the check `if (!nf_at_oids_must && *code != LDAP_SUCCESS)` does not trigger (code stays 0), the struct is returned with a NULL field, and subsequent `print_oids(ss, NULL)` dereferences NULL at `sa[0]` (L305).","An attacker controlling an LDAP server (or performing MITM) sends a nameform schema definition containing `MUST ()` (empty MUST OID list); the LDAP client calls `ldap_str2nameform` which succeeds and returns an `nf` struct with `nf_at_oids_must == NULL`, then calls `ldap_nameform2bv` to pretty-print it, triggering a NULL pointer dereference (SIGSEGV) and crashing the client process.",,
N5,openldap/openldap,519e0c94c9f3804813f691de487283ad7586f510,PROP-N5-npd-087,potential-vulnerability,libraries/libldap/test.c::get_modlist::L199-218,"Proof fails at two sites in get_modlist: (1) calloc at L199 is not checked before bvals[i] is written at L202, so OOM causes an immediate NULL dereference; (2) malloc at L202 is not checked before bvals[i]->bv_val is written at L215-216, another NULL dereference. get_list has the same pattern: malloc/realloc at L88-91 are not checked before result[num++] at L93. The print_search_entry concern (ldap_get_dn NULL at L754) is mitigated because ldap_dn2ufn handles NULL safely (getdn.c:371-373).","An attacker who can exhaust process memory (e.g., via ulimit or resource pressure on the host running the test binary) triggers calloc/malloc failure in get_modlist or get_list, causing a NULL pointer dereference and crash; however, this is a local interactive CLI test utility, not a network-accessible server component, so direct external triggering is not straightforward.",,
N5,openldap/openldap,519e0c94c9f3804813f691de487283ad7586f510,PROP-N5-npd-104,potential-vulnerability,libraries/libldap/urltest.c::main::L40-128,"`ldap_url_parse` internally uses `LDAP_PVT_URL_PARSE_HISTORIC` which includes `LDAP_PVT_URL_PARSE_NOEMPTY_HOST`; when parsing a URL with an empty host (e.g., `ldapi:///`), `lud_host` is explicitly freed and set to NULL (url.c:992-998) while the parse still returns `LDAP_URL_SUCCESS`. Lines 84 and 88 of `urltest.c` then pass `lud->lud_host` (NULL) directly to `fprintf` as a `%s` argument without any NULL guard, which is undefined behavior in C and can crash on non-Linux platforms. Additionally, `ldap_url_desc2str(lud)` at line 125 can return NULL on allocation failure and is also passed unchecked to `fprintf`.","Run `urltest ldapi:///`; `ldap_url_parse` returns success with `lud->lud_host == NULL`, then `fprintf(stdout, ""PATH: %s\n"", NULL)` is called at line 84, triggering undefined behavior (crash on macOS/BSD/Windows).",,
N5,openldap/openldap,519e0c94c9f3804813f691de487283ad7586f510,PROP-N5-npd-112,potential-vulnerability,libraries/liblmdb/mdb_copy.c::main::L65-79,"When `mdb_env_create(&env)` fails (e.g., ENOMEM via calloc failure), it returns without setting `*env`, leaving the stack-allocated `env` variable uninitialised. `mdb_env_close(env)` is then called unconditionally at line 79; since garbage != NULL it bypasses the NULL guard in mdb_env_close (mdb.c:5173) and immediately dereferences `env->me_dpages`, causing undefined behaviour/crash. Contrast with mdb_stat.c which correctly early-exits on mdb_env_create failure.","An attacker or unprivileged user who can invoke `mdb_copy` under memory pressure (OOM) causes the process to crash via the uninitialised pointer dereference; however, external LDAP network reachability does not apply since mdb_copy is a standalone CLI utility, limiting this to a local crash/DoS scenario.",,
N5,openldap/openldap,519e0c94c9f3804813f691de487283ad7586f510,PROP-N5-npd-120,potential-vulnerability,libraries/liblmdb/mtest4.c::main::L44-47,"The return value of `malloc(510 * sizeof(int))` at L44 is never checked for NULL before `values[i]` is first dereferenced at L47, constituting a null pointer dereference if allocation fails. All other pointer dereferences in the file (env, txn, cursor) are guarded by the `E()` macro which calls `abort()` on failure, and stack arrays (`sval`, `kval`) are always valid. The NPD flaw is real but `mtest4.c` is a standalone test binary—not linked into the LDAP server—so the property's claim of external reachability via LDAP is incorrect.","On a memory-constrained system, if `malloc(2040–4080 bytes)` returns NULL when the test binary is executed, the subsequent `values[0] = 0` at L47 dereferences NULL and crashes the test program; no network attacker can trigger this via LDAP as `mtest4` is an independent test executable.",,
N5,openldap/openldap,519e0c94c9f3804813f691de487283ad7586f510,PROP-N5-npd-152,potential-vulnerability,libraries/librewrite/context.c::rewrite_context_apply::L368-370,"The REWRITE_ACTION_USER branch at line 369 dereferences action->la_args without any null check or assert, while the analogous rewrite_action_goto path (also in context.c) explicitly asserts action->la_args != NULL before dereference (line 173). Normal construction in rewrite_rule_compile always sets la_args before creating REWRITE_ACTION_USER actions, so current code paths are safe; however, destroy_action in rule.c uses incorrect switch constants (REWRITE_FLAG_GOTO/'G'=71 vs REWRITE_ACTION_GOTO=3) that never match, revealing inconsistent invariant assumptions about la_args across the codebase — the defensive null check never executes and la_args is always leaked.","An LDAP rewrite configuration with a 'U' (user-error) flag on a rule, combined with any code path that creates a REWRITE_ACTION_USER action without setting la_args (e.g., programmatic API misuse or a future code path), would cause a null-pointer dereference crash in rewrite_context_apply when an LDAP client sends a request matching that rule, enabling remote denial of service.",,
N5,openldap/openldap,519e0c94c9f3804813f691de487283ad7586f510,PROP-N5-npd-160,potential-vulnerability,libraries/librewrite/rule.c::rewrite_rule_compile::L157,"The property requires all pointer dereferences in rule.c to be preceded by null checks. At L157, `for ( p = flagstring; p[ 0 ] != '\0'; p++ )` dereferences `flagstring` without any null guard, despite the explicit comment at L140-143 stating 'A null flagstring should be allowed' (all other parameters have `assert(X != NULL)` guards at L136-139). The only current caller (config.c:254) always passes `""""` rather than NULL, so the bug is latent — no current external path exercises the crash.","If any caller passes NULL as `flagstring` to `rewrite_rule_compile` (as the documented API contract permits), the immediate dereference at L157 causes a NULL pointer dereference crash; a future internal caller or an API extension trusting the documented NULL-safe contract would trigger this.",,
N5,openldap/openldap,519e0c94c9f3804813f691de487283ad7586f510,PROP-N5-npd-016,potential-vulnerability,libraries/liblber/dtest.c::main::L78-81,"`ber_sockbuf_alloc()` at line 78 can return NULL on heap allocation failure (confirmed in sockbuf.c:62), but `sb` is passed directly to `ber_sockbuf_add_io()` at line 80 with no null guard; `ber_sockbuf_add_io()` begins with `assert(sb != NULL)` (sockbuf.c:180), which aborts the process on NULL. Sibling program `etest.c` checks `sb == NULL` after the same call pattern, confirming the guard was intended but omitted in `dtest.c`.","On a memory-constrained host where `ber_sockbuf_alloc()` returns NULL, invoking `dtest` (e.g., piping attacker-supplied BER data to stdin) triggers the assertion abort in `ber_sockbuf_add_io`, crashing the process before any data is parsed.",,
N5,openldap/openldap,519e0c94c9f3804813f691de487283ad7586f510,PROP-N5-npd-024,potential-vulnerability,libraries/liblber/sockbuf.c::ber_sockbuf_add_io::L194-208,"`ber_sockbuf_add_io` inserts the IO descriptor into the chain (`*q = d` at L204) before calling `sbi_setup`; if `sb_rdahead_setup` returns -1 (e.g., OOM from its internal `LBER_MALLOC`), the descriptor remains in the chain with `sbiod_pvt = NULL`. Callers at `connection.c:452`, `open.c:391`, and `open.c:468` do not check the return value of `ber_sockbuf_add_io`, so the connection proceeds. The next `ber_int_sb_read` call traverses to `sb_rdahead_read`, which dereferences `sbiod->sbiod_pvt` as a `Sockbuf_Buf*` at L630-632 without any null check, causing a null-pointer dereference (SIGSEGV at offset 0).","An attacker floods the OpenLDAP server with connection/data requests to exhaust memory; under OOM, a new connection's `sb_rdahead_setup` LBER_MALLOC fails silently (callers ignore the -1 return), leaving a broken readahead descriptor in the IO chain. When the client sends LDAP data, the server reaches `sb_rdahead_read` and dereferences a NULL `sbiod_pvt`, crashing the process (DoS via SIGSEGV).",,
N5,openldap/openldap,519e0c94c9f3804813f691de487283ad7586f510,PROP-N5-npd-032,potential-vulnerability,libraries/libldap/avl.c::avl_buildlist::L594-611,"In `avl_buildlist`, after `ber_memalloc` (L599) and `ber_memrealloc` (L604-606), the returned pointer is assigned directly to `avl_list` with no NULL check before `avl_list[avl_maxlist++] = data` at L608. Both `ber_memalloc` and `ber_memrealloc` can return NULL on OOM (confirmed by other callers in memory.c that do check). The `ber_memrealloc` failure also leaks the original block. All other dereferences in avl.c are properly NULL-guarded; this is the sole violation.","An attacker who can exhaust slapd/libldap server memory (e.g., via repeated resource-intensive LDAP requests) and then cause a caller of `ldap_avl_getfirst` to invoke `avl_buildlist` on a non-empty tree will trigger a NULL dereference at L608, crashing the process. Within slapd itself `ldap_avl_getfirst` is not called, but the function is exported from libldap and any consuming application is affected.",,
N5,openldap/openldap,519e0c94c9f3804813f691de487283ad7586f510,PROP-N5-npd-008,vulnerability,clients/tools/ldapsearch.c::dosearch::L1844-1851,"In `dosearch()`, `ldap_parse_intermediate` is called without checking its return value, and `retoid` is used immediately in `strcmp(retoid, LDAP_SYNC_INFO)` at line 1851 without a null check. The `ldap_parse_intermediate` implementation (extended.c:333,401-402) initializes `*retoidp = NULL` and only sets it to a non-null OID if the LDAP Intermediate Response message includes the optional `responseName` field (RFC 4511 §4.13 makes this field OPTIONAL). When the server sends an Intermediate Response without a responseName, `retoid` remains NULL and `strcmp(NULL, ...)` crashes the process.","A malicious LDAP server (or MITM attacker) sends an `LDAP_RES_INTERMEDIATE` message without a responseName OID while ldapsearch is performing a syncrepl or persistent search operation; ldapsearch calls `ldap_parse_intermediate` which returns with `retoid = NULL`, and the subsequent `strcmp(NULL, LDAP_SYNC_INFO)` at line 1851 causes a null pointer dereference, crashing the client process.",,
