project_id,repo,commit,property_id,classification,code_path,proof_trace,attack_scenario,result,reason
U3,shadowsocks/shadowsocks-libev,8e52029d311df3880ffb1c5bea922f6e0e3cecdd,PROP-U3-uaf-002,vulnerability,src/local.c::free_connections::L237-246,"Use-after-free in free_remote() when called from free_connections(). After close_and_free_server() frees the server memory, remote->server still points to freed memory, which is then dereferenced in free_remote() when setting remote->server->remote = NULL.","Attacker triggers cleanup conditions through external callbacks, causing free_connections() to execute and corrupt freed memory via the use-after-free, potentially leading to code execution.",TP,UAF — close_and_free_server frees then remote->server used
U3,shadowsocks/shadowsocks-libev,8e52029d311df3880ffb1c5bea922f6e0e3cecdd,PROP-U3-uaf-011,vulnerability,src/local.c::remote_recv_cb::L857-870,"close_and_free_remote() called at L857 frees remote pointer, but execution continues without return statement to L870 where setsockopt(remote->fd) accesses freed memory.","External attacker sends network data causing send() error in remote_recv_cb(), triggering close_and_free_remote() at L857, then use-after-free access at L870.",TP,Matches RepoAudit ground truth bug
U3,shadowsocks/shadowsocks-libev,8e52029d311df3880ffb1c5bea922f6e0e3cecdd,PROP-U3-uaf-003,vulnerability,src/acl.c::update_block_list::L299-303,"cache_lookup returns direct pointer to cache entry data, but block_list_clear_cb timer can interrupt execution and free the memory via cache_clear before the caller dereferences the pointer. The race occurs between cache_lookup return and pointer dereference in update_block_list.","Client triggers connection error causing update_block_list call, block_list_clear_cb timer fires during execution freeing the cached count data, then (*count) += err_level dereferences freed memory.",TP,Race UAF — timer frees cache entry while caller holds pointer
U3,shadowsocks/shadowsocks-libev,8e52029d311df3880ffb1c5bea922f6e0e3cecdd,PROP-U3-uaf-004,potential-vulnerability,src/udprelay.c::cache_insert_pattern::L638-640,"Cache insertion followed by immediate remote_ctx access creates race condition risk. While LRU eviction should not evict newly inserted entries, cache_insert can trigger free_cb callbacks that could theoretically affect memory safety.","If cache eviction triggers unexpected behavior or race conditions during cache_insert, subsequent access to remote_ctx->io and remote_ctx->watcher could dereference freed memory, leading to crashes or code execution.",FP,Speculative race — LRU should not evict newly inserted entries
U3,shadowsocks/shadowsocks-libev,8e52029d311df3880ffb1c5bea922f6e0e3cecdd,PROP-U3-uaf-006,vulnerability,src/json.c::json_value_free_ex::L960,"Function assumes tree structure but doesn't validate against shared references. When JSON contains shared json_value objects, the same object gets processed multiple times, causing line 960 `value->type` to dereference freed memory after the shared object was freed in a previous iteration.","Attacker provides JSON with shared references (e.g., array elements pointing to same object). First traversal frees the shared object, second traversal accesses freed memory.",FP,Shared references not created in normal JSON API use
U3,shadowsocks/shadowsocks-libev,8e52029d311df3880ffb1c5bea922f6e0e3cecdd,PROP-U3-uaf-007,vulnerability,src/server.c::free_connections::L214-214,"The cork_dllist_foreach_void macro dereferences curr->next after close_and_free_server() frees the server object containing the entries field. The macro increments via curr=next; next=curr->next, causing UAF when accessing the freed entries.next pointer.","External attacker sends SIGINT/SIGTERM to trigger program cleanup, causing memory corruption in free_connections() that can lead to arbitrary code execution.",TP,UAF — dllist macro dereferences next after free
U3,shadowsocks/shadowsocks-libev,8e52029d311df3880ffb1c5bea922f6e0e3cecdd,PROP-U3-uaf-008,vulnerability,src/resolv.c::resolv_cancel::L223,"resolv_cancel() incorrectly calls ss_free() on dns_query structures at line 223, but these are allocated and owned by libudns which expects to free them in dns_end_query() or dns_close(). This causes double-free when the program later shuts down.","Client triggers DNS resolution then disconnects, causing close_and_free_server() → resolv_cancel() → ss_free() of libudns-owned memory, leading to heap corruption on program shutdown.",TP,Double-free — resolv_cancel frees libudns-owned memory
