project_id,repo,commit,property_id,classification,code_path,proof_trace,attack_scenario,result,reason
N4,OpenKinect/libfreenect,d913755a25d09fbe2869a0d2acea78f589bfe6bf,PROP-N4-npd-002,potential-vulnerability,fakenect/fakenect.c::parse_line::L141,"Property statement is semantically incorrect (get_data_size returns int, not pointer), but real issue exists: get_data_size can return -1 on ftell error, which gets cast to huge unsigned value when passed to malloc at line 143.","Attacker provides corrupted file causing ftell to fail, leading to malloc with massive size allocation.",FP,Property semantically incorrect — returns int not pointer
N4,OpenKinect/libfreenect,d913755a25d09fbe2869a0d2acea78f589bfe6bf,PROP-N4-npd-010,vulnerability,wrappers/actionscript/server/freenect_network.c::freenect_network_init::L48,"Function freenect_network_initSocket() returns error status codes but callers at lines 48 and 61 ignore return values completely. Socket initialization failures go undetected, causing subsequent network operations to use uninitialized socket values.","Network initialization fails due to resource exhaustion or permissions, but caller proceeds with uninitialized socket values, leading to crashes or undefined behavior in accept/read/write operations.",FP,Not NPD — error handling deficiency. fd=-1 on failed socket causes EBADF on read/write but no NULL pointer dereference. Bug exists as error handling issue but wrong bug type for NPD benchmark. Opus human review also concluded FP.
N4,OpenKinect/libfreenect,d913755a25d09fbe2869a0d2acea78f589bfe6bf,PROP-N4-npd-011,vulnerability,wrappers/c_sync/libfreenect_sync.c::init_thread::L220-224,"freenect_init() can fail and set ctx=NULL (malloc failure, USB init failure), but init_thread() ignores return value and passes potentially NULL ctx to freenect_select_subdevices() which immediately dereferences ctx->enabled_subdevices without NULL check.","When freenect_init() fails due to USB issues or memory exhaustion, ctx becomes NULL, causing segmentation fault in freenect_select_subdevices() when accessed via public APIs like freenect_sync_get_video().",TP,Matches RepoAudit ground truth bug
N4,OpenKinect/libfreenect,d913755a25d09fbe2869a0d2acea78f589bfe6bf,PROP-N4-npd-005,vulnerability,src/registration.c::freenect_init_registration_table::L289-292,"malloc() return values at lines 289-290 are dereferenced by memset() at lines 291-292 and by array access at lines 296, 300-301 without NULL checks. Memory allocation can fail causing immediate segfault.","Attacker triggers depth mode initialization when system memory is low, causing malloc to fail and segfault the application when memset or array access occurs.",TP,NPD — malloc without NULL check in init_registration_table。PR #697提出済み(OPEN)。メンテナ反応なし。待ち。
N4,OpenKinect/libfreenect,d913755a25d09fbe2869a0d2acea78f589bfe6bf,PROP-N4-npd-008,potential-vulnerability,fakenect/parson.c::json_serialize_to_string_pretty::L1519-1536,"Function can return NULL in three scenarios (malloc failure, zero buffer size, serialization failure) but is exposed as public API without enforced NULL-checking mechanism for external callers. Internal caller does check correctly, but external applications may dereference without validation.","External application calls json_serialize_to_string_pretty() and directly uses returned pointer (e.g., strlen(result)) without NULL check, causing segmentation fault when function returns NULL due to memory allocation failure or invalid input.",FP,API can return NULL but internal callers do check
